{
  "milestone": "M0",
  "run_id": "20261009T101500Z-s42",
  "criteria": [
    {
      "id": "AC-1",
      "status": "dat",
      "evidence": [
        "logs/m0/20261009T101500Z-s42/smoke.json"
      ],
      "note": null
    },
    {
      "id": "AC-2",
      "status": "dat",
      "evidence": [
        "logs/m0/20261009T101500Z-s42/smoke.json"
      ],
      "note": null
    },
    {
      "id": "AC-3",
      "status": "dat",
      "evidence": [
        "logs/m0/20261009T101500Z-s42/benchmark.json"
      ],
      "note": null
    },
    {
      "id": "AC-4",
      "status": "chua_dat",
      "evidence": [
        "logs/m0/20261009T101500Z-s42/benchmark.json"
      ],
      "note": "GPU không khả dụng: không tìm thấy nvidia-smi"
    },
    {
      "id": "AC-5",
      "status": "chua_chay",
      "evidence": [],
      "note": "chưa thử dựng lại trên môi trường sạch"
    }
  ],
  "gate_open": false,
  "remaining_issues": [
    "AC-4: cần đo GPU trên máy đích",
    "AC-5: chưa kiểm hướng dẫn trên môi trường sạch"
  ],
  "next_milestone_proposal": "Giữ M0 mở đến khi AC-4 và AC-5 đạt; sau đó M1.",
  "sources": {
    "env": "logs/m0/20261009T101500Z-s42/env.json",
    "smoke": "logs/m0/20261009T101500Z-s42/smoke.json",
    "benchmark": "logs/m0/20261009T101500Z-s42/benchmark.json"
  }
}
